code,department,course_title,course_number,campus,breadth_category,distribution_category,course_description,num_credits,prerequisite,exclusion,recommended_prep
MAT137Y1,MAT,Calculus with Proofs,137,1,5,Science,"<p>A conceptual approach for students with a serious interest in mathematics. Attention is given to computational aspects as well as theoretical foundations and problem solving techniques. Review of Trigonometry. Limits and continuity, mean value theorem, inverse function theorem, differentiation, integration, fundamental theorem of calculus, elementary transcendental functions, Taylor's theorem, sequence and series, power series. Applications.</p>",1,High school level calculus,"MAT135H1, MAT135H5, MAT136H1, MAT136H5, MAT157Y1,  MATA35H3, MATA36H3, MATA37H3,  MAT135Y5, MAT137Y5, MAT138Y5, MAT187H, MAT196H, MAT197H, ESC194H, ESC195H.
Students will receive credit for both MAT137Y1 and MAT138H1 if MAT138H1 is taken before or along with MAT137Y1.",
MAT138H1,MAT,Introduction to Proofs,138,1,5,Science,"<p>The goal of this course is for students to become comfortable with abstraction, rigour, logic, and proofs. They will practice reading and understanding mathematical statements, analyzing definitions and properties, formulating conjectures and generalizations, providing and writing reasonable and precise arguments, writing and critiquing proofs. The instructor may use specific mathematical content, which could vary from year to year, to practice these skills. The course is aimed at students interested in the creative character of mathematics, particularly those planning to take any of our proof-oriented courses, and is an excellent preparation for MAT137Y1, MAT157Y1, or MAT240H1.</p> <br /> <p>Note: students may take this course concurrently with MAT157Y1 or MAT137Y1, or prior to registering in MAT157Y1 or MAT137Y1. This course can also be used by students who have already taken MAT136H1 and wish to bridge the gap to MAT237Y1.</p>",0.5,High school level calculus,MAT157Y1,
MAT157Y1,MAT,Analysis I,157,1,5,Science,"<p>A theoretical course in calculus; emphasizing proofs and techniques, as well as geometric and physical understanding. Trigonometric identities. Limits and continuity; least upper bounds, intermediate and extreme value theorems. Derivatives, mean value and inverse function theorems. Integrals; fundamental theorem; elementary transcendental functions. Techniques of integration. Taylor's theorem; sequences and series; uniform convergence and power series.</p>",1,High school level calculus,"MAT137Y1, MATA37H3, MAT137Y5, MAT157Y5, MAT197H1, ESC195H1.",Students should consider taking the Preparing for University Math Level II in order to prepare in advance for MAT157Y1. Students may also take MAT138H1 concurrently with MAT157Y1. Students will receive credit for both MAT157Y1 and MAT138H1 if MAT138H1 is taken before or along with MAT157Y1.
MAT192H1,MAT,Liberating Mathematics,192,1,5,Science,"<p>Currently, mathematics is at a crossroads between tradition and progress. Progress has been led in large part by women mathematicians, in particular Black women, Indigenous women, and women from visible minorities. Intertwined in their studies of mathematics is a daring critique of traditional mathematics, re-imagining of mathematics culture, and more. This course will compare and contrast new forms of accessible mathematics with standard sources that draw dominantly on the experiences and narratives of men. Restricted to first-year students. Not eligible for CR/NCR option.</p>",0.5,High school level algebra.,,
MAT193H1,MAT,Women’s Mathematics,193,1,5,Science,"<p>Mathematics has been shaped in significant ways by the work of outstanding female mathematicians such as Hypatia, Emmy Noether, Sofia Kovalevskaya, and Maryam Mirzakhani. Despite these successes, women still experience barriers to entering the field and participating at the highest levels. This course will blend an exploration of mathematics created by women with a study of the issue of women in mathematics. Students will have the opportunity to examine the complex factors that impact women’s participation in STEM, learn about the lives of female mathematicians, create their own mathematics, and sharpen their spatial cognition and logical thinking skills.</p>",0.5,High school level algebra.,Not intended for students in a Mathematics Specialist or Major program.,
MAT198H1,MAT,Cryptology: The Mathematics of Secrecy and Security,198,1,5,Science,"<p>How do we send our own confidential information through secure channels, and how can we break codes to uncover the secret information of our adversaries? The mathematical field of cryptology is dedicated to answering such questions. In this course we will study breakthroughs in cryptology, from secret messages in the ancient world and the Enigma cipher in World War II, to modern cryptosystems that facilitate online commerce. Along the way, you will develop a sophisticated understanding of how numbers interact and develop the ability to communicate messages secretly and mathematics clearly. Restricted to first-year students. Not eligible for CR/NCR option.</p>",0.5,High school level algebra.,Not intended for students in a Mathematics Specialist or Major program.,
MAT221H1,MAT,Applied Linear Algebra,221,1,5,Science,"<p>An application-oriented approach to linear algebra, based on calculations in standard Euclidean space. Systems of linear equations, matrices, Gauss-Jordan elimination, subspaces, bases, orthogonal vectors and projections. Matrix inverses, kernel and range, rank-nullity theorem. Determinants, eigenvalues and eigenvectors, Cramer's rule, diagonalization. This course has strong emphasis on building computational skills in the area of algebra. Applications to curve fitting, economics, Markov chains and cryptography.</p>",0.5,High school level calculus,"MAT223H1, MATA23H3, MAT223H5, MAT224H1, MAT240H1, MAT240H5, MAT247H1, MAT247H5",
MAT223H1,MAT,Linear Algebra I,223,1,5,Science,"<p>Systems of linear equations, matrix algebra, real vector spaces, subspaces, span, linear dependence and independence, bases, rank, inner products, orthogonality, orthogonal complements, Gram-Schmidt, linear transformations, determinants, Cramer's rule, eigenvalues, eigenvectors, eigenspaces, diagonalization.</p>",0.5,High school level calculus,"MATA22H3, MATA23H3, MAT223H5, MAT224H1, MAT240H1, MAT240H5, MAT247H1, MAT247H5",
MAT224H1,MAT,Linear Algebra II,224,1,5,Science,"<p>Fields, complex numbers, vector spaces over a field, linear transformations, matrix of a linear transformation, kernel, range, dimension theorem, isomorphisms, change of basis, eigenvalues, eigenvectors, diagonalizability, real and complex inner products, spectral theorem, adjoint/self-adjoint/normal linear operators, triangular form, nilpotent mappings, Jordan canonical form.</p>",0.5,MAT221H1(80%)/MAT223H1/MAT240H1/MATA22H3,MAT247H1,
MAT235Y1,MAT,Multivariable Calculus,235,1,5,Science,"<p>Parametric equations and polar coordinates. Vectors, vector functions and space curves. Differential and integral calculus of functions of several variables. Line integrals and surface integrals and classic vector calculus theorems. Examples from life sciences and physical science applications.</p>",1,"(MAT135H1/MAT135H5/MATA30H3/MATA31H3, MAT136H1/MAT136H5/MATA36H3/MATA37H3)/MAT135Y5/MAT137Y1/MAT137Y5/MAT157Y1/MAT157Y5","MAT237Y1, MAT257Y1, MATB41H3, MATB42H3, MAT232H5, MAT233H5, MAT236H5, MAT368H5, MAT291H & MAT294H",
MAT237Y1,MAT,Multivariable Calculus with Proofs,237,1,5,Science,"<p>Sequences and series. Uniform convergence. Convergence of integrals. Elements of topology in R^2 and R^3. Differential and integral calculus of vector valued functions of a vector variable, with emphasis on vectors in two and three dimensional euclidean space. Extremal problems, Lagrange multipliers, line and surface integrals, vector analysis, Stokes' theorem, Fourier series, calculus of variations.</p>",1,"MAT137Y1/MAT157Y1/(MAT135H1/MAT135H5, MAT136H1(85%)/MAT136H5 (85%), MAT138H1), MAT223H1/MAT240H1","MAT235Y1, MAT257Y1, MATB41H3, MATB42H3, MATB43H3 & MAT368H5, MAT232H5 & MAT236H5",
MAT240H1,MAT,Algebra I,240,1,5,Science,"<p>A theoretical approach to: vector spaces over arbitrary fields, including C and Z_p. Subspaces, bases and dimension. Linear transformations, matrices, change of basis, similarity, determinants. Polynomials over a field (including unique factorization, resultants). Eigenvalues, eigenvectors, characteristic polynomial, diagonalization. Minimal polynomial, Cayley-Hamilton theorem.</p>",0.5,High school level calculus,,
MAT244H1,MAT,Introduction to Ordinary Differential Equations,244,1,5,Science,"<p>First order ordinary differential equations: Direction fields, integrating factors, separable equations, homogeneous equations, exact equations, autonomous equations, modeling. Existence and uniqueness theorem. Higher order equations: Constant coefficient equations, reduction of order, Wronskian, method of undetermined coefficients, variation of parameters. Solutions by series and integrals. First order linear systems, fundamental matrices. Non-linear equations, phase plane, stability. Applications in life and physical sciences and economics.</p>",0.5,"(MAT135H1/MAT135H5/MATA35H3/MATA30H3/MATA31H3, MAT136H1/MAT136H5/MATA36H3/MATA37H3)/MAT135Y5/MAT137Y1/MAT137Y5/MAT157Y1/MAT157Y5, MAT223H1/MATA23H3/MAT223H5/MAT240H1/MAT240H5","MAT267H1, MAT212H5, MAT258Y5",
MAT245H1,MAT,Mathematical Methods in Data Science,245,1,5,Science,"<p> An introduction to the mathematical methods behind scientific techniques developed for extracting information from large data sets. Elementary probability density functions, conditional expectation, inverse problems, regularization, dimension reduction, gradient methods, singular value decomposition and its applications, stability, diffusion maps. Examples from applications in data science and big data. <br /> <br /> <br /> </p>",0.5,"MAT137Y1/MAT157Y1, MAT223H1/MAT240H1, MAT224H1/MAT247H1",,
MAT246H1,MAT,Concepts in Abstract Mathematics,246,1,5,Science,"<p>Designed to introduce students to mathematical proofs and abstract mathematical concepts. Topics may include modular arithmetic, sizes of infinite sets, and a proof that some angles cannot be trisected with straightedge and compass.</p>",0.5,"MAT133Y1/(MAT135H1/MAT135H5, MAT136H1/MAT136H5)/MAT137Y1,MAT223H1/MAT240H1",MAT157Y1,
MAT247H1,MAT,Algebra II,247,1,5,Science,"<p>A theoretical approach to real and complex inner product spaces, isometries, orthogonal and unitary matrices and transformations. The adjoint. Hermitian and symmetric transformations. Spectral theorem for symmetric and normal transformations. Polar representation theorem. Primary decomposition theorem. Rational and Jordan canonical forms. Additional topics including dual spaces, quotient spaces, bilinear forms, quadratic surfaces, multilinear algebra. </p>",0.5,MAT240H1/MAT240H5,,
MAT257Y1,MAT,Analysis II,257,1,5,Science,"<p>Topology of R^n; compactness, functions and continuity, extreme value theorem. Derivatives; inverse and implicit function theorems, maxima and minima, Lagrange multipliers. Integration; Fubini's theorem, partitions of unity, change of variables. Differential forms. Manifolds in R^n; integration on manifolds; Stokes' theorem for differential forms and classical versions.</p>",1,"MAT157Y1/MAT157Y5, MAT247H1/MAT247H5",,
MAT267H1,MAT,Advanced Ordinary Differential Equations,267,1,5,Science,"<p>A theoretical course on Ordinary Differential Equations. First-order equations: separable equations, exact equations, integrating factors. Variational problems, Euler-Lagrange equations. Linear equations and first-order systems. Fundamental matrices, Wronskians. Non-linear equations. Existence and uniqueness theorems. Method of power series. Elementary qualitative theory; stability, phase plane, stationary points. Oscillation theorem, Sturm comparison. Applications in mechanics, physics, chemistry, biology and economics.</p>",0.5,"MAT157Y1/MAT157Y5, MAT247H1/MAT247H5","APM288H1, MAT244H1, MATB44H3, MAT242H5, MAT252H5, MAT234H1, MAT292H1",
MAT271H1,MAT,Insights from Mathematics,271,1,5,Science,<p>This breadth course is accessible to students with limited mathematical background. Various mathematical techniques will be illustrated with examples from humanities and social science disciplines. Some of the topics will incorporate user friendly computer explorations to give participants the feel of the subject without requiring skill at calculations.</p> <p>Note: This course cannot be used to satisfy requirements of program in the math department.</p>,0.5,,,
MAT296H1,MAT,Independent Reading in Mathematics,296,1,5,Science,<p>Independent study under the direction of a faculty member. Topic must be outside undergraduate offerings. Workload equivalent to a 36L course. Not eligible for CR/NCR option.</p>,0.5,Minimum GPA of 3.5 in APM and MAT courses. Permission of the Associate Chair for Undergraduate Studies and of the prospective supervisor.,,
MAT301H1,MAT,Groups and Symmetries,301,1,5,Science,"<p>Congruences and fields. Permutations and permutation groups. Linear groups. Abstract groups, homomorphisms, subgroups. Symmetry groups of regular polygons and Platonic solids, wallpaper groups. Group actions, class formula. Cosets, Lagrange theorem. Normal subgroups, quotient groups. Classification of finitely generated abelian groups. Emphasis on examples and calculations.</p>",0.5,"MAT224H1/MAT247H1, MAT235Y1/MAT237Y1, MAT246H1/MAT157Y1/CSC236H1/CSC240H1. (These Prerequisites will be waived for students who have MAT257Y1.) For FASE students, MAT185H, MAT194H, MAT195H.",MAT347Y1,
MAT309H1,MAT,Introduction to Mathematical Logic,309,1,5,Science,<p>Predicate calculus. Relationship between truth and provability; Gödel's completeness theorem. First order arithmetic as an example of a first-order system. Gödel's incompleteness theorem; outline of its proof. Introduction to recursive functions.</p>,0.5,"MAT223H1/MATA23H3/MAT223H5/MAT240H1/MAT240H5, MAT235Y1/MAT235Y5/(MAT232H5, MAT236H5/MATB41H3, MATB42H3)/MAT237Y1/(MATB41H3, MATB42H3, MATB43H3)/MAT237Y5, MAT246H1/MAT157Y1/CSC236H1/CSC240H1 (These Prerequisites will be waived for students who have MAT257Y1)",CSC438H1,
MAT315H1,MAT,Introduction to Number Theory,315,1,5,Science,"<p>Elementary topics in number theory: arithmetic functions; polynomials over the residue classes modulo m, characters on the residue classes modulo m; quadratic reciprocity law, representation of numbers as sums of squares.</p>",0.5,"(MAT223H1/MATA23H3/MAT223H5/MAT240H1/MAT240H5, MAT235Y1/MAT235Y5/(MAT232H5, MAT236H5)/(MATB41H3, MATB42H3)/MAT237Y1/(MATB41H3, MATB42H3, MATB43H3)/MAT237Y5, MAT246H1/CSC236H1/CSC240H1)/MAT157Y1/MAT157Y5/MAT247H1/MAT247H5",,
MAT327H1,MAT,Introduction to Topology,327,1,5,Science,"<p>Metric spaces, topological spaces and continuous mappings; separation, compactness, connectedness. Fundamental group and covering spaces. Brouwer fixed-point theorem. Students in the math specialist program wishing to take additional topology courses are advised to obtain permission to take MAT1300H, MAT1301H.</p>",0.5,"MAT157Y1/MAT157Y5/(MAT237Y1/(MATB41H3, MATB42H3, MATB43H3)/MAT237Y5, MAT246H1/MAT157Y1 and permission of the instructor)",,
MAT329Y1,MAT,Concepts in Elementary Mathematics,329,1,5,Science,"<p>This course is aimed at students intending to become elementary school teachers. Emphasis is placed on the formation and development of fundamental reasoning and learning skills required to understand and to teach mathematics at the elementary level. Topics may include: Problem Solving and Strategies, Sets and Elementary Logic, Numbers and Elements of Number Theory, Introductory Probability and Fundamentals of Geometry. </p> <p>The course may include an optional practicum in school classrooms. </p>",1,(MAT137Y1/MAT157Y1)/MAT138H1/(MAT223H1/MAT240H1)/(MAT246H1/MAT157Y1) and any 5.0 FCE with a CGPA of at least 2.5,MAT382H5,Participation in the practicum requires the presentation of an Ontario Police Report that declares suitability to work with minors and other special groups.
MAT332H1,MAT,Introduction to Graph Theory,332,1,5,Science,"<p>This course will explore the following topics: Graphs, subgraphs, isomorphism, trees, connectivity, Euler and Hamiltonian properties, matchings, vertex and edge colourings, planarity, network flows and strongly regular graphs. Participants will be encouraged to use these topics and execute applications to such problems as timetabling, tournament scheduling, experimental design and finite geometries.</p>",0.5,MAT224H1/MATB24H3/MAT224H5/MAT247H1/MAT247H5,,
MAT334H1,MAT,Complex Variables,334,1,5,Science,"<p>Theory of functions of one complex variable, analytic and meromorphic functions. Cauchy's theorem, residue calculus, conformal mappings, introduction to analytic continuation and harmonic functions.</p>",0.5,"MAT223H1/MATA23H3/MAT223H5/MAT240H1/MAT240H5, MAT235Y1/MAT235Y5/(MAT232H5, MAT236H5)/(MATB41H3, MATB42H3)/MAT237Y1/(MATB41H3, MATB42H3, MATB43H3)/MAT237Y5/MAT257Y1",MAT354H1,
MAT336H1,MAT,Elements of Analysis,336,1,5,Science,"<p>This course provides the foundations of analysis and rigorous calculus for students who will take subsequent courses where these mathematical concepts are central of applications, but who have only taken courses with limited proofs. Topics include topology of Rn, implicit and inverse function theorems and rigorous integration theory.</p>",0.5,"MAT223H1/MATA23H3/MAT223H5/MAT240H1/MAT240H5, MAT235Y1/MAT235Y5/(MAT232H5, MAT236H5)/(MATB41H3, MATB42H3)/MAT237Y1/(MATB41H3, MATB42H3, MATB43H3)/MAT237Y5; (for FASE students, MAT185H, MAT195H/ESC195H)","MAT257Y1, MAT337H1",
MAT337H1,MAT,Introduction to Real Analysis,337,1,5,Science,"<p>Construction of Real Numbers. Metric spaces; compactness and connectedness. Sequences and series of functions, power series; modes of convergence. Interchange of limiting processes; differentiation of integrals. Function spaces; Weierstrass approximation; Fourier series. Contraction mappings; existence and uniqueness of solutions of ordinary differential equations. Countability; Cantor set; Hausdorff dimension.</p>",0.5,"MAT224H1/MATB24H3/MAT224H5/MAT247H1/MAT247H5, MAT235Y1/MAT235Y5/(MAT232H5, MAT236H5)/(MATB41H3, MATB42H3)/MAT237Y1/(MATB41H3, MATB42H3, MATB43H3)/MAT237Y5, MAT246H1/MAT157Y1; NOTE: These Prerequisites will be waived for students who have MAT257Y1",MAT357H1 & MAT378H5,
MAT344H1,MAT,Introduction to Combinatorics,344,1,5,Science,"<p>Basic counting principles, generating functions, permutations with restrictions. Fundamentals of graph theory with algorithms; applications (including network flows). Combinatorial structures including block designs and finite geometries.</p>",0.5,MAT223H1/MATA23H3/MAT223H5/MAT240H1/MAT240H5,,
MAT347Y1,MAT,"Groups, Rings and Fields",347,1,5,Science,"<p>Groups, subgroups, quotient groups, Sylow theorems, Jordan-Hölder theorem, finitely generated abelian groups, solvable groups. Rings, ideals, Chinese remainder theorem; Euclidean domains and principal ideal domains: unique factorization. Noetherian rings, Hilbert basis theorem. Finitely generated modules. Field extensions, algebraic closure, straight-edge and compass constructions. Galois theory, including insolvability of the quintic.</p>",1,MAT257Y1/(85% in MAT247H1/MAT247H5),,
MAT351Y1,MAT,Partial Differential Equations,351,1,5,Science,"<p>This is a first course in Partial Differential Equations, intended for Mathematics students with interests in analysis, mathematical physics, geometry, and optimization. The examples to be discussed include first-order equations, harmonic functions, the diffusion equation, the wave equation, Schrodinger's equation, and eigenvalue problems. In addition to the classical representation formulas for the solutions of these equations, there are techniques that apply more broadly: the notion of well-posedness, the method of characteristics, energy methods, maximum and comparison principles, fundamental solutions, Green's functions, Duhamel's principle, Fourier series, the min-max characterization of eigenvalues, Bessel functions, spherical harmonics, and distributions. Nonlinear phenomena such as shock waves and solitary waves are also introduced.</p>",1,"MAT257Y1/85% in MAT237Y1, MAT267H1",APM351Y1,
MAT354H1,MAT,Complex Analysis I,354,1,5,Science,"<p>Complex numbers, the complex plane and Riemann sphere, Möbius transformations, elementary functions and their mapping properties, conformal mapping, holomorphic functions, Cauchy's theorem and integral formula. Taylor and Laurent series, maximum modulus principle, Schwarz' lemma, residue theorem and residue calculus.</p> <br /> <p>Note: Students may take MAT354H1 after they complete MAT334H1, however, in this case, MAT334H1 will count as 'extra'; it will not count as credit towards program requirements.</p>",0.5,MAT257Y1,,
MAT357H1,MAT,Foundations of Real Analysis,357,1,5,Science,"<p>Function spaces; Arzela-Ascoli theorem, Weierstrass approximation theorem, Fourier series. Introduction to Banach and Hilbert spaces; contraction mapping principle, fundamental existence and uniqueness theorem for ordinary differential equations. Lebesgue integral; convergence theorems, comparison with Riemann integral, L^p spaces. Applications to probability.</p>",0.5,MAT257Y1/(MAT327H1 and permission of instructor),MAT438H5,
MAT363H1,MAT,Geometry of Curves and Surfaces,363,1,5,Science,<p>Curves and surfaces in 3-spaces. Frenet formulas. Curvature and geodesics. Gauss map. Minimal surfaces. Gauss-Bonnet theorem for surfaces. Surfaces of constant curvature. </p>,0.5,"MAT224H1/MATB24H3/MAT224H5/MAT247H1/MAT247H5, MAT237Y1/(MATB41H3, MATB42H3, MATB43H3)/MAT237Y5/MAT257Y1 (MAT257Y1 can be taken concurrently). For FASE students, MAT185H, MAT194H, MAT195H, AER210H.",MAT367H1,
MAT367H1,MAT,Differential Geometry,367,1,5,Science,"<p>Manifolds, partitions of unity, submersions and immersions, vector fields, vector bundles, tangent and cotangent bundles, foliations and Frobenius’ theorem, multillinear algebra, differential forms, Stokes’ theorem, Poincare-Hopf theorem</p>",0.5,"MAT257Y1/(MAT224H1/MAT247Y1, MAT237Y1,MAT246H1/MAT157Y1,and permission of instructor)",,"Multivariable calculus (MAT257Y1); Linear algebra (MAT240H1, MAT247H1)"
MAT377H1,MAT,Mathematical Probability,377,1,5,Science,"<p>This course introduces students to various topics in mathematical probability theory. Topics include basic concepts (such as probability, random variables, expectations, conditional probability) from a mathematical point of view, examples of distributions and stochastic processes and their properties, convergence results (such as the law of large numbers, central limit theorem, random series, etc.); various inequalities, and examples of applications of probabilistic ideas beyond statistics (for example, in geometry and computer science). </p>",0.5,"MAT247H1/MAT247H5, MAT257Y1",STA347H1,
MAT382H1,MAT,Topics in Mathematics,382,1,5,Science,"<p>A course in mathematics on a topic outside the current undergraduate offerings.  For information on the specific topic to be studied and possible additional preqrequisites, go to http://www.math.toronto.edu/cms/current-students-ug/</p>",0.5,2.5 FCE in 100-level or 200-level APM or MAT courses. Possible additional topic-specific prerequisites.,,
MAT390H1,MAT,History of Mathematics up to 1700,390,1,5,Science,"<p>A survey of ancient, medieval, and early modern mathematics with emphasis on historical issues. (Offered in alternate years)</p>",0.5,At least 1.0 FCE in APM/MAT at the 200 level.,"HPS309H1, HPS310Y1, HPS390H1",
MAT391H1,MAT,History of Mathematics after 1700,391,1,5,Science,<p>A survey of the development of mathematics from 1700 to the present with emphasis on technical development. (Offered in alternate years)</p>,0.5,At least 1.0 FCE in APM/MAT at the 200 level.,"HPS309H1, HPS310H1, HPS391H1",
MAT395H1,MAT,Independent Reading in Mathematics,395,1,5,Science,<p>Independent reading under the direction of a faculty member. Topic must be outside current undergraduate offerings. Similar workload to a 36L course. Not eligible for CR/NCR option.</p>,0.5,Minimum GPA of 3.5 in APM and MAT courses. Permission of the Associate Chair for Undergraduate Studies and of the prospective supervisor,,
MAT396H1,MAT,Independent Reading in Mathematics,396,1,5,Science,<p>Independent study under the direction of a faculty member. Topic must be outside undergraduate offerings. Similar workload to a 36L course. Not eligible for CR/NCR option.</p>,0.5,Minimum GPA of 3.5 in APM and MAT courses. Permission of the Associate Chair for Undergraduate Studies and of the prospective supervisor,,
MAT401H1,MAT,Polynomial Equations and Fields,401,1,5,Science,"<p>Commutative rings; quotient rings. Construction of the rationals. Polynomial algebra. Fields and Galois theory: Field extensions, adjunction of roots of a polynomial. Constructibility, trisection of angles, construction of regular polygons. Galois groups of polynomials, in particular cubics, quartics. Insolvability of quintics by radicals.</p>",0.5,MAT301H1,MAT347Y1,
MAT402H1,MAT,Classical Geometries,402,1,5,Science,<p>Euclidean and non-euclidean plane and space geometries. Real and complex projective space. Models of the hyperbolic plane. Connections with the geometry of surfaces.</p>,0.5,"MAT301H1/MAT347Y1, MAT235Y1/MAT237Y1/MAT257Y1",,
MAT409H1,MAT,Set Theory,409,1,5,Science,"<p>Set theory and its relations with other branches of mathematics. ZFC axioms. Ordinal and cardinal numbers. Reflection principle. Constructible sets and the continuum hypothesis. Introduction to independence proofs. Topics from large cardinals, infinitary combinatorics and descriptive set theory.</p> <p>Joint undergraduate/graduate course - MAT409H1/MAT1404H</p>",0.5,MAT357H1,,
