code,department,course_title,course_number,campus,breadth_category,distribution_category,course_description,num_credits,prerequisite,exclusion,recommended_prep
CSC384H1,CSC,Introduction to Artificial Intelligence,384,1,5,Science,"<p>Theories and algorithms that capture (or approximate) some of the core elements of computational intelligence. Topics include: search; logical representations and reasoning, classical automated planning, representing and reasoning with uncertainty, learning, decision making (planning) under uncertainty. Assignments provide practical experience, in both theory and programming, of the core topics.</p>",0.5,"(CSC263H1/​ CSC265H1/ CSC263H5/ CSCC63H3/ ECE345H1/ ECE358H1/ MIE335H1, STA237H1/ STA247H1/​ STA255H1/​ STA257H1/ STA237H1/ STAB57H3/ STAB52H3/ ECE302H1/ STA286H1/ CHE223H1/ CME263H1/ MIE231H1/ MIE236H1/ MSE238H1/ ECE286H1)","NOTE: Students not enrolled in the Computer Science Major or Specialist program at FAS, UTM, or UTSC, or the Data Science Specialist at FAS, are limited to a maximum of three 300-/400-level CSC/ECE half-courses.",CSC324H1
CSC385H1,CSC,Microprocessor Systems,385,1,5,Science,"<p>Microprocessor and embedded systems: Software techniques for real-time task creation and management. Connected device charachteristics and the hardware and software ramifications. System construction and management. An examination of the issues unique to or particulaly important to embedded computing. Laboratory experiments provide ""hands on"" experience. An open team project is done in the last few laboratory sessions.</p>",0.5,CSC258H1; CSC209H1/proficiency in C,"CSC372H1, ECE385H1. NOTE: Students not enrolled in the Computer Science Major or Specialist program at FAS, UTM, or UTSC, or the Data Science Specialist at FAS, are limited to a maximum of three 300-/400-level CSC/ECE half-courses.",
CSC399Y1,CSC,Research Opportunity Program,399,1,,,"<p>Credit course for supervised participation in faculty research project. Details at <a href=""https://www.artsci.utoronto.ca/current/academics/research-opportunities/research-opportunities-program"">https://www.artsci.utoronto.ca/current/academics/research-opportunities/research-opportunities-program</a>. Not eligible for CR/NCR option.</p>",1,,"NOTE: Students not enrolled in the Computer Science Major or Specialist program at FAS, UTM, or UTSC, or the Data Science Specialist at FAS, are limited to a maximum of three 300-/400-level CSC/ECE half-courses.",
CSC401H1,CSC,Natural Language Computing,401,1,5,Science,"<p>Introduction to techniques involving natural language processing and speech in applications such as information retrieval, speech recognition and synthesis, machine translation, summarization, and dialogue. N-grams, corpus analysis, neural methods, and information theory. Python and other software.</p>",0.5,CSC207H1/ CSC209H1/ CSC207H5/ CSCB07H3/ CSC209H5/ CSCB09H3/ APS105H1/ APS106H1/ ESC180H1/ CSC180H1; STA237H1/ STA247H1/​ STA255H1/ ​STA257H1/ STAB57H3/ STAB52H3/ ECE302H1/ STA286H1/ CHE223H1/ CME263H1/ MIE231H1/ MIE236H1/ MSE238H1/ ECE286H1,"NOTE: Students not enrolled in the Computer Science Major or Specialist program at the FAS, UTM, or UTSC, or the Data Science Specialist at FAS, are limited to a maximum of three 300-/400-level CSC/ECE half-courses.",MAT221H1/MAT223H1/MAT240H1 is strongly recommended
CSC404H1,CSC,Introduction to Video Game Design,404,1,1,Science,"<p>Concepts and techniques for the design and development of electronic games. History, social issues, and story elements. The business of game development and game promotion. Software engineering, artificial intelligence, and graphics elements. Level and model design. Audio elements. Practical assignments leading to team implementation of a complete game.</p>",0.5,CSC301H1/CSC317H1/CSC318H1/CSC384H1/CSC417H1/CSC418H1/CSC419H1,"NOTE: Students not enrolled in the Computer Science Major or Specialist program at the FAS, UTM, or UTSC, or the Data Science Specialist at FAS, are limited to a maximum of three 300-/400-level CSC/ECE half-courses.",
CSC410H1,CSC,Software Testing and Verification,410,1,5,Science,"<p>Concepts and state-of-the-art techniques in quality assessment for software engineering; quality attributes; formal specifications and their analysis; testing, verification, and validation.</p>",0.5,"CSC207H1, CSC236H1/CSC240H1","NOTE: Students not enrolled in the Computer Science Major or Specialist program at the FAS, UTM, or UTSC, or the Data Science Specialist at FAS, are limited to a maximum of three 300-/400-level CSC/ECE half-courses.",CSC330H1
CSC412H1,CSC,Probabilistic Learning and Reasoning,412,1,5,Science,<p>An introduction to probability as a means of representing and reasoning with uncertain knowledge. Qualitative and quantitative specification of probability distributions using probabilistic graphical models. Algorithms for inference and probabilistic reasoning with graphical models. Statistical approaches and algorithms for learning probability models from empirical data. Applications of these models in artificial intelligence and machine learning.</p>,0.5,CSC311H1/ CSC411H1/ STA314H1/ ECE421H1/ ROB313H1/ CSCC11H3/CSC311H5,"STA414H1. NOTE: Students not enrolled in the Computer Science Major or Specialist program at the FAS, UTM, or UTSC, or the Data Science Specialist at FAS, are limited to a maximum of three 300-/400-level CSC/ECE half-courses.",
CSC413H1,CSC,Neural Networks and Deep Learning,413,1,5,Science,<p>An introduction to neural networks and deep learning. Backpropagation and automatic differentiation. Architectures: convolutional networks and recurrent neural networks. Methods for improving optimization and generalization. Neural networks for unsupervised and reinforcement learning.</p>,0.5,"CSC311H1/​ CSC311H5/ CSCC11H3/ CSC411H1/ STA314H1/ ECE421H1/ ROB313H1/; MAT235Y1/​ MAT237Y1/​ MAT257Y1/ MAT257Y5/ MAT291H1/ MAT294H1/ AER210H1/ (MAT232H5, MAT236H5)/ (MAT233H5, MAT236H5)/ (MATB41H3, MATB42H3); 
MAT221H1/ MAT223H1/ MAT240H1/ MAT185H1/ MAT188H1/ MAT223H5/ MATA23H3","CSC321H1/CSC421H1. NOTE: Students not enrolled in the Computer Science Major or Specialist program at the FAS, UTM, or UTSC, or the Data Science Specialist at FAS, are limited to a maximum of three 300-/400-level CSC/ECE half-courses.",
CSC417H1,CSC,Physics-Based Animation,417,1,5,Science,"<p>This course is designed to introduce students to the field of physics-based animation by exposing them to the underlying mathematical and algorithmic techniques required to understand and develop efficient numerical simulations of physical phenomena such as rigid bodies, deformable bodies and fluids. Topics covered include rigid body simulation, elasticity simulation, cloth simulation, collision detection and resolution and fluid simulation. Along the way, we will explore the underlying mathematics of ordinary differential equations, discrete time integration, finite element methods and more.<br /><br />Students should have a strong background in Linear Algebra and Multivariate Calculus.</p>",0.5,MAT235Y1/ MAT237Y1/ MAT257Y1/ MAT291H1/ MAT294H1; MAT221H1/ ​MAT223H1/​ MAT240H1/ MAT185H1/ MAT188H1; CSC209H1/ ​proficiency in C or C++/ APS105H1/ ESC180H1/ CSC180H1,"NOTE: Students not enrolled in the Computer Science Major or Specialist program at FAS, UTM, or UTSC, or the Data Science Specialist at FAS, are limited to a maximum of three 300-/400-level CSC/ECE half-courses.",
CSC420H1,CSC,Introduction to Image Understanding,420,1,5,Science,<p>Introduction to basic concepts in computer vision. Extraction of image features at multiple scales. Robust estimation of model parameters. Multiview geometry and reconstruction. Image motion estimation and tracking. Object recognition. Topics in scene understanding as time permits.</p>,0.5,"CSC263H1/ CSC265H1/ ECE345H1/ ECE358H1/ MIE335H1; (MAT135H1, MAT136H1)/ MAT137Y1/ MAT157Y1/ (MAT186H1, MAT187H1)/ (MAT194H1, MAT195H1)/ (ESC194H1, ESC195H1); MAT221H1/ MAT223H1/ MAT240H1/ MAT185H1/ MAT188H1","NOTE: Students not enrolled in the Computer Science Major or Specialist program at the FAS, UTM, or UTSC, or the Data Science Specialist at FAS, are limited to a maximum of three 300-/400-level CSC/ECE half-courses.",CSC320H1
CSC428H1,CSC,Human-Computer Interaction,428,1,5,Science,"<p>Understanding human behaviour as it applies to user interfaces: work activity analysis, observational techniques, questionnaire administration, and unobtrusive measures. Operating parameters of the human cognitive system, task analysis and cognitive modelling techniques and their application to designing interfaces. Interface representations and prototyping tools. Cognitive walkthroughs, usability studies and verbal protocol analysis. Case studies of specific user interfaces.</p>",0.5,CSC318H1; STA237H1/ STA247H1/ ​STA255H1/ ​STA257H1/ ECE302H1/ STA286H1/ CHE223H1/ CME263H1/ MIE231H1/ MIE236H1/ MSE238H1/ ECE286H1; CSC209H1/​ proficiency in C or C++ or Java/ APS105H1/ ESC180H1/ CSC180H1,"NOTE: Students not enrolled in the Computer Science Major or Specialist program at the FAS, UTM, or UTSC, or the Data Science Specialist at FAS, are limited to a maximum of three 300-/400-level CSC/ECE half-courses.","A course in PSY; CSC209H1; (STA248H1/STA250H1/STA261H1)/(PSY201H1, PSY202H1)/(SOC202H1, SOC300H1)"
CSC446H1,CSC,Computational Methods for Partial Differential Equations,446,1,5,Science,"<p>Finite Difference and Finite Element methods for boundary value problems including 2-point boundary value problems and 2-dimensional problems. Convergence of methods. Efficiency of the solution of linear systems. Finite difference methods for initial value problems. Consistency, stability and convergence. Method of lines. Special topics of interest among domain decomposition, multigrid, FFT solvers. Ordinarily offered in years alternating with CSC466H1.</p>",0.5,CSC351H1/(CSC336H1 (75%))/equivalent mathematical background; MAT237Y1/MAT257Y1; APM346H1/MAT351Y1/(MAT244H1/MAT267H1 and exposure to PDEs),"NOTE: Students not enrolled in the Computer Science Major or Specialist program at the FAS, UTM, or UTSC, or the Data Science Specialist at FAS, are limited to a maximum of three 300-/400-level CSC/ECE half-courses.",
CSC448H1,CSC,Formal Languages and Automata,448,1,5,Science,"<p>Regular, deterministic, context free, context sensitive, and recursively enumerable languages via generative grammars and corresponding automata (finite state machines, push down machines, and Turing machines). Topics include complexity bounds for recognition, language decision problems and operations on languages. Ordinarily offered in years alternating with CSC438H1.</p>",0.5,"CSC236H1/CSC240H1, CSC263H1/CSC265H1","NOTE: Students not enrolled in the Computer Science Major or Specialist program at the FAS, UTM, or UTSC, or the Data Science Specialist at FAS, are limited to a maximum of three 300-/400-level CSC/ECE half-courses.",CSC373H1
CSC454H1,CSC,The Business of Software,454,1,5,Science,"<p>Designed and delivered by industry experts in successful commercialization of tech startups, this course focuses on the development of a viable business and startup in partnership and mentorship from industry businesses and entrepreneurs.</p> <p>The course is designed to be taken by students from any faculty or discipline. It focuses on helping them understand and develop business sense, introduce modern customer development, and teach skills in product development, financial management, marketing, and leadership. Alongside the software engineering abilities of CSC491H1 teammates, skills learned in CSC454H1 will aid the development of a viable startup.</p> <p>For more details visit our website at <a href=""https://www.dcsil.ca/student-courses"">https://www.dcsil.ca/student-courses</a>.</p> <p>Not eligible for CR/NCR option.</p>",0.5,2.5 credits at the 300-level or higher,"NOTE: Students not enrolled in the Computer Science Major or Specialist program at the FAS, UTM, or UTSC, or the Data Science Specialist at FAS, are limited to a maximum of three 300-/400-level CSC/ECE half-courses.",
CSC457H1,CSC,Principles of Computer Networks,457,1,5,Science,"<p>The course covers fundamental principles of computer networks, as well as currently used network architectures and protocols. Its emphasis is 1) to explain why reliable data transfer, addressing, routing and congestion control are the fundamental concepts, 2) to explore the design principles behind algorithms/protocols for reliable data transfer, addressing, routing and congestion control and 3) to use current protocols such as TCP/IP, ARQ, Ethernet, CSMA/CD, DNS and Internet routing protocols as examples of concrete implementations/designs of these protocols. It will highlight the trade-offs (and approaches to navigate these trade-offs) in the design of computer network protocols.</p>",0.5,"CSC373H1/CSC373H5/CSCC73H3, STA247H1/STA255H1/STA257H1/STA237H1","CSC358H1; NOTE: Students not enrolled in the Computer Science Major or Specialist program at FAS, UTM, or UTSC, or the Data Science Specialist at FAS, are limited to a maximum of three 300-/400-level CSC/ECE half-courses.","CSC309H1, CSC369H1"
CSC458H1,CSC,Computer Networking Systems,458,1,5,Science,"<p>Computer networks with an emphasis on network systems, network programming, and applications. Networking basics: layering, routing, congestion control, and the global Internet. Network systems design and programming: Internet design, socket programming, and packet switching system fundamentals. Additional topics include network security, multimedia, software-defined networking, peer-to-peer networking, and online social networks.</p>",0.5,"CSC209H1, CSC258H1, CSC263H1/CSC265H1, STA247H1/STA255H1/STA257H1/STA237H1/ECO227Y1","NOTE: Students not enrolled in the Computer Science Major or Specialist program at the FAS, UTM, or UTSC, or the Data Science Specialist at FAS, are limited to a maximum of three 300-/400-level CSC/ECE half-courses.",
CSC463H1,CSC,Computational Complexity and Computability,463,1,5,Science,"<p>Introduction to the theory of computability: Turing machines and other models of computation, Church’s thesis, computable and noncomputable functions, recursive and recursively enumerable sets, many-one reductions. Introduction to complexity theory: P, NP, polynomial time reducibility, NP-completeness, self-reducibility, space complexity (L, NL, PSPACE and completeness for those classes); hierarchy theorems, and provably intractable problems.</p>",0.5,CSC236H1/CSC240H1/CSC236H5/CSCB36H3,"CSC363H1/CSC363H5/CSCC63H3/CSC365H1. NOTE: Students not enrolled in the Computer Science Major or Specialist program at the FAS, UTM, or UTSC, or the Data Science Specialist at FAS, are limited to a maximum of three 300-/400-level CSC/ECE half-courses.
",
CSC465H1,CSC,Formal Methods in Software Design,465,1,5,Science,"<p>Using mathematics to write error-free programs. Proving each refinement; identifying errors as they are made. Program development to meet specifications; modifications that preserve correctness. Useful for all programming; essential for programs that lives depend on. Basic logic, formal specifications, refinement. Conditional, sequential, parallel, interaction, probabilistic programming, and functional programming.</p>",0.5,CSC236H1/CSC240H1/MAT309H1/CSC236H5/CSCB36H3,"NOTE: Students not enrolled in the Computer Science Major or Specialist program at the FAS, UTM, or UTSC, or the Data Science Specialist at FAS, are limited to a maximum of three 300-/400-level CSC/ECE half-courses.",
CSC469H1,CSC,Operating Systems Design and Implementation,469,1,5,Science,"<p>An in-depth exploration of the major components of operating systems with an emphasis on the techniques, algorithms, and structures used to implement these components in modern systems. Project-based study of process management, scheduling, memory management, file systems, and networking is used to build insight into the intricacies of a large concurrent system.</p>",0.5,CSC369H1,"NOTE: Students not enrolled in the Computer Science Major or Specialist program at the FAS, UTM, or UTSC, or the Data Science Specialist at FAS, are limited to a maximum of three 300-/400-level CSC/ECE half-courses.",
CSC485H1,CSC,Computational Linguistics,485,1,5,Science,"<p>Computational linguistics and the processing of language by computer. Topics include: context-free grammars; chart parsing, statistical parsing; semantics and semantic interpretation; ambiguity resolution techniques; reference resolution. Emphasis on statistical learning methods for lexical, syntactic, and semantic knowledge.</p>",0.5,CSC209H1/ APS105H1/ APS106H1/ ESC180H1/ CSC180H1; STA237H1/ STA247H1/​ STA255H1/ ​STA257H1/ ECE302H1/ STA286H1/ CHE223H1/ CME263H1/ MIE231H1/ MIE236H1/ MSE238H1/ ECE286H1,"NOTE: Students not enrolled in the Computer Science Major or Specialist program at the FAS, UTM, or UTSC, or the Data Science Specialist at FAS, are limited to a maximum of three 300-/400-level CSC/ECE half-courses.",CSC324H1/CSC384H1
CSC486H1,CSC,Knowledge Representation and Reasoning,486,1,5,Science,"<p>Representing knowledge symbolically in a form suitable for automated reasoning, and associated reasoning methods. Topics from: first-order logic, entailment, the resolution method, Horn clauses, procedural representations, production systems, description logics, inheritance networks, defaults and probabilities, tractable reasoning, abductive explanation, the representation of action, planning.</p>",0.5,CSC384H1/ CSC384H5/ ROB311H1,"NOTE: Students not enrolled in the Computer Science Major or Specialist program at the FAS, UTM, or UTSC, or the Data Science Specialist at FAS, are limited to a maximum of three 300-/400-level CSC/ECE half-courses.",
CSC488H1,CSC,Compilers and Interpreters,488,1,5,Science,"<p>The structure of compilers, Programming language processing. Scanning based on regular expressions, Parsing using context free grammars, Semantic analysis (type and usage checking); Compiler dictionaries and tables. Runtime organization and storage allocation, code generation, optimization. Use of modern compiler building tools. Course project involves building a complete compiler.</p>",0.5,"CSC258H1/CSC258H5/CSCB58H3, CSC324H1/CSC324H5/CSCC24H3, CSC263H1/CSC265H1/CSC263H5/CSCB63H3","NOTE: Students not enrolled in the Computer Science Major or Specialist program at the FAS, UTM, or UTSC, or the Data Science Specialist at FAS, are limited to a maximum of three 300-/400-level CSC/ECE half-courses.",
CSC490H1,CSC,Capstone Design Project,490,1,5,Science,"<p>This half-course gives students experience solving a substantial problem that may span several areas of Computer Science. Students will define the scope of the problem, develop a solution plan, produce a working implementation, and present their work using written, oral, and (if suitable) video reports. Class time will focus on the project, but may include some lectures. The class will be small and highly interactive. Project themes change each year. Contact the Computer Science Undergraduate Office for information about this year’s topic themes, required preparation, and course enrolment procedures. Not eligible for CR/NCR option.</p>",0.5,Permission of the instructor,"NOTE: Students not enrolled in the Computer Science Major or Specialist program at the FAS, UTM, or UTSC, or the Data Science Specialist at FAS, are limited to a maximum of three 300-/400-level CSC/ECE half-courses.",
CSC491H1,CSC,Capstone Design Project,491,1,5,Science,"<p>This course is designed and delivered by industry experts from the Software/Tech fields. Students will work with teammates from CSC454H1 to develop a marketable startup on a selected theme.</p> <p>The class will be small and highly interactive. You will work to develop working software industry best practices. You are expected to have experience writing software and be able to learn on the go.</p> <p>For more details, visit our website at <a href=""https://www.dcsil.ca/student-courses"">https://www.dcsil.ca/student-courses</a>.</p> <p>Contact the Computer Science Undergraduate Office for course enrollment procedures. Not eligible for CR/NCR option.</p>",0.5,Permission of the instructor,"NOTE: Students not enrolled in the Computer Science Major or Specialist program at the FAS, UTM, or UTSC, or the Data Science Specialist at FAS, are limited to a maximum of three 300-/400-level CSC/ECE half-courses.",2.5 CSC credits at the 300-level or higher.
CSC494H1,CSC,Computer Science Project,494,1,5,Science,<p>This half-course involves a significant project in any area of Computer Science. The project may be undertaken individually or in small groups. The course is offered by arrangement with a Computer Science faculty member. Not eligible for CR/NCR option.</p>,0.5,"Three 300-/400-level CSC half-courses, and permission of the Associate Chair, Undergraduate Studies. Contact the Computer Science Undergraduate Office for information about course enrolment procedures.","NOTE: Students not enrolled in the Computer Science Major or Specialist program at FAS, UTM, or UTSC, or the Data Science Specialist at FAS, are limited to a maximum of three 300-/400-level CSC/ECE half-courses.",
CSC494Y1,CSC,Computer Science Project,494,1,5,Science,<p>This course involves a significant project in any area of Computer Science. The project may be undertaken individually or in small groups. The course is offered by arrangement with a Computer Science faculty member. Not eligible for CR/NCR option.</p>,1,"Three 300-/400-level CSC half-courses, and permission of the Associate Chair, Undergraduate Studies. Contact the Computer Science Undergraduate Office for information about course enrolment procedures.","NOTE: Students not enrolled in the Computer Science Major or Specialist program at FAS, UTM, or UTSC, or the Data Science Specialist at FAS, are limited to a maximum of three 300-/400-level CSC/ECE half-courses.",
CSC495H1,CSC,Computer Science Project,495,1,5,Science,<p>This half-course involves a significant project in any area of Computer Science. The project may be undertaken individually or in small groups. The course is offered by arrangement with a Computer Science faculty member. Not eligible for CR/NCR option.</p>,0.5,"Three 300-/400-level CSC half-courses, and permission of the Associate Chair, Undergraduate Studies. Contact the Computer Science Undergraduate Office for information about course enrolment procedures.","NOTE: Students not enrolled in the Computer Science Major or Specialist program at FAS, UTM, or UTSC, or the Data Science Specialist at FAS, are limited to a maximum of three 300-/400-level CSC/ECE half-courses.",
MAT133Y1,MAT,Calculus and Linear Algebra for Commerce,133,1,5,Science,"<p>Mathematics of finance. Matrices and linear equations. Review of differential calculus; applications. Integration and fundamental theorem; applications. Introduction to partial differentiation; applications.</p> <p>NOTE: please note Prerequisites listed below. Students without the proper prerequisites for <a href=""http://www.artsandscience.utoronto.ca/ofr/calendar/crs_mat.htm#MAT133Y1"">MAT133Y1</a> may be deregistered from this course.</p> <p><strong>Note that MAT133Y is not a valid prerequisite for a number of more advanced quantitative courses. Students who are considering a quantitative non-Commerce PoSt, such as a math minor or a stats minor, may want to consider MAT135H and MAT136H, MAT137Y, or MAT157Y instead of MAT133Y. Specifically, a student who took MAT133Y may need to subsequently take MAT135H and MAT136H as ""extra"" or take MAT137Y or MAT157Y in order to proceed in non-Commerce PoSts.</strong></p>",1,High school level calculus,"MAT135H1, MAT135H5, MAT136H1, MAT136H5, MAT137Y1, MAT157Y1, MATA30H3, MATA31H3, MATA32H3, MATA33H3, MATA35H3, MATA36H3, MATA37H3,  MAT133Y5, MAT134Y5, MAT135Y5, MAT137Y5, MAT138Y5, MAT186H, MAT187H, MAT196H & MAT197H, ESC194H, ESC195H",
MAT135H1,MAT,Calculus I,135,1,5,Science,"<p>In this first introduction to Calculus, students will be introduced to the tools of differential calculus, the branch of calculus that is motivated by the problem of measuring how quantities change. Students will use these tools to solve other problems, including simplifying functions with straight lines, describing how different types of change are related, and computing maximum and minimum quantities. This course will focus on developing a deep understanding of why the tools of calculus make sense and how to apply them to the social, biological, and physical sciences. It will also emphasize translating between algebraic, graphical, numerical and verbal descriptions of each concept studied.</p>",0.5,High school level calculus,"MAT133Y1 MAT135H5, MAT136H1, MAT136H5, MAT137Y1, MAT157Y1, MATA30H3, MATA31H3, MATA32H3, MATA33H3, MATA35H3, MATA36H3, MATA37H3,  MAT133Y5, MAT134Y5, MAT135Y5, MAT137Y5, MAT138Y5, MAT186H, MAT187H, MAT196H, MAT197H, ESC194H, ESC195H,",
MAT136H1,MAT,Calculus II,136,1,5,Science,"<p>This second part of the introductory Calculus sequence focuses on integral calculus beginning with the Fundamental Theorem of Calculus, the connection between two seemingly unrelated problems: measuring changing quantities and finding areas of curved shapes. Students will develop a deep understanding of the integral, and use it to: unpack equations involving derivatives; to make sense of infinite sums; to write complicated functions as 'infinite polynomials'; and to compute areas, volumes, and totals in applied problems. This course will further develop students' abilities to translate between algebraic, graphical, numerical, and verbal descriptions of mathematics in a variety of applied contexts.</p>",0.5,MAT135H1,"MAT133Y1, MAT137Y1, MAT157Y1,  MATA32H3, MATA33H3, MATA36H3, MATA37H3,  MAT133Y5, MAT134Y5, MAT135Y5, MAT137Y5, MAT138Y5, MAT186H, MAT187H, MAT196H, MAT197H, ESC194H, ESC195H.",
